{
  "schema_version": 1,
  "target_profile": "nvidia-gpu",
  "suite_id": "gpu/tensornetwork",
  "timestamp": "2026-10-17T14:13:27.525120+00:00",
  "tenferro_commit": "4de2e1226337e877066f129667b70c2a01308bfb",
  "hardware": {
    "gpu": "NVIDIA A100 80GB PCIe",
    "host": "98b13ebfe249"
  },
  "unit": "ms",
  "rows": [
    {
      "case": "tensornetwork_permutation_optimized_f32",
      "group": "tensor_network_contract",
      "backend": "pytorch-cuda",
      "median": 110.5857245,
      "iqr": 1.1255120000000005,
      "status": "ok",
      "verified": true
    },
    {
      "case": "tensornetwork_permutation_optimized_f32",
      "group": "tensor_network_contract",
      "backend": "tenferro-cuda-eager",
      "median": 51.0046155,
      "iqr": 0.8145950000000042,
      "status": "ok",
      "verified": true
    },
    {
      "case": "tensornetwork_permutation_optimized_f32",
      "group": "tensor_network_contract",
      "backend": "tenferro-cuda-trace",
      "median": 53.518719000000004,
      "iqr": 0.9220669999999984,
      "status": "ok",
      "verified": true
    }
  ]
}
