{
  "schema_version": 1,
  "target_profile": "zen5-cpu",
  "suite_id": "cpu/overhead_smoke",
  "timestamp": "2026-10-28T01:14:19Z",
  "tenferro_commit": "8fec1ca70852b930c092e7177c30bb8af7594a57",
  "hardware": {
    "host": "bcfefbe95606",
    "threads": [
      1
    ]
  },
  "unit": "ns",
  "rows": [
    {
      "case": "concatenate_axis1_f64_8x8x8",
      "group": "threads=1 / scope=steady_state_host_api",
      "backend": "tenferro-rs",
      "median": 1336.92431640625,
      "iqr": 15.688232421875,
      "status": "ok",
      "verified": true,
      "timing_scope": "steady_state_host_api",
      "backend_thread_budget": 1,
      "host_allocations_per_op": 0.0,
      "host_allocated_bytes_per_op": 0.0
    },
    {
      "case": "einsum_prepared_f64_n2",
      "group": "threads=1 / scope=steady_state_host_api",
      "backend": "tenferro-rs",
      "median": 730.28759765625,
      "iqr": 0.67626953125,
      "status": "ok",
      "verified": true,
      "timing_scope": "steady_state_host_api",
      "backend_thread_budget": 1,
      "host_allocations_per_op": 0.0,
      "host_allocated_bytes_per_op": 0.0
    },
    {
      "case": "einsum_prepared_f64_n4",
      "group": "threads=1 / scope=steady_state_host_api",
      "backend": "tenferro-rs",
      "median": 762.353759765625,
      "iqr": 2.0936279296875,
      "status": "ok",
      "verified": true,
      "timing_scope": "steady_state_host_api",
      "backend_thread_budget": 1,
      "host_allocations_per_op": 0.0,
      "host_allocated_bytes_per_op": 0.0
    },
    {
      "case": "permute_materialize_f64_r4_4x4x4x4",
      "group": "threads=1 / scope=steady_state_host_api",
      "backend": "tenferro-rs",
      "median": 1086.38427734375,
      "iqr": 2.631591796875,
      "status": "ok",
      "verified": true,
      "timing_scope": "steady_state_host_api",
      "backend_thread_budget": 1,
      "host_allocations_per_op": 0.0,
      "host_allocated_bytes_per_op": 0.0
    },
    {
      "case": "prepared_mul_add_f64_budget1_32x32x32_session_entry_diagnostic",
      "group": "threads=1 / scope=public_path_latency_including_internal_session_entry",
      "backend": "tenferro-rs",
      "median": 20883.203125,
      "iqr": 341.5703125,
      "status": "ok",
      "verified": true,
      "timing_scope": "public_path_latency_including_internal_session_entry",
      "backend_thread_budget": 1,
      "host_allocations_per_op": 26.0625,
      "host_allocated_bytes_per_op": 12758.125
    },
    {
      "case": "prepared_mul_add_f64_budget2_32x32x32_session_entry_diagnostic",
      "group": "threads=1 / scope=public_path_latency_including_internal_session_entry",
      "backend": "tenferro-rs",
      "median": 449313.875,
      "iqr": 452.125,
      "status": "ok",
      "verified": true,
      "timing_scope": "public_path_latency_including_internal_session_entry",
      "backend_thread_budget": 2,
      "host_allocations_per_op": 26.0,
      "host_allocated_bytes_per_op": 12656.0
    },
    {
      "case": "reduce_axis_f64_8x8x8",
      "group": "threads=1 / scope=steady_state_host_api",
      "backend": "tenferro-rs",
      "median": 1134.31884765625,
      "iqr": 7.496826171875,
      "status": "ok",
      "verified": true,
      "timing_scope": "steady_state_host_api",
      "backend_thread_budget": 1,
      "host_allocations_per_op": 0.0,
      "host_allocated_bytes_per_op": 0.0
    },
    {
      "case": "typed_elemwise_f64_add_bcast_8x8x8",
      "group": "threads=1 / scope=steady_state_host_api",
      "backend": "tenferro-rs",
      "median": 900.25927734375,
      "iqr": 8.41650390625,
      "status": "ok",
      "verified": true,
      "timing_scope": "steady_state_host_api",
      "backend_thread_budget": 1,
      "host_allocations_per_op": 0.0,
      "host_allocated_bytes_per_op": 0.0
    },
    {
      "case": "typed_elemwise_f64_add_bcast_n16",
      "group": "threads=1 / scope=steady_state_host_api",
      "backend": "tenferro-rs",
      "median": 762.58837890625,
      "iqr": 2.71484375,
      "status": "ok",
      "verified": true,
      "timing_scope": "steady_state_host_api",
      "backend_thread_budget": 1,
      "host_allocations_per_op": 0.0,
      "host_allocated_bytes_per_op": 0.0
    },
    {
      "case": "typed_elemwise_f64_add_permuted_view_8x8x8",
      "group": "threads=1 / scope=steady_state_host_api",
      "backend": "tenferro-rs",
      "median": 1065.0947265625,
      "iqr": 2.45068359375,
      "status": "ok",
      "verified": true,
      "timing_scope": "steady_state_host_api",
      "backend_thread_budget": 1,
      "host_allocations_per_op": 0.0625,
      "host_allocated_bytes_per_op": 102.125
    }
  ]
}
